ecosystem,packageName,name,displayName,description,recipeCount,category1,category2,category1Description,category2Description,options,dataTables
maven,org.openrewrite:rewrite-docker,org.openrewrite.docker.AddOrUpdateLabel,Add Docker LABEL instruction,"Adds or updates a LABEL instruction in a Dockerfile. By default, adds to the final stage only.",1,,Docker,,Recipes to perform [Docker](https://docker.com/) migration tasks.,"[{""name"":""key"",""type"":""String"",""displayName"":""Label key"",""description"":""The key of the label to add."",""example"":""org.opencontainers.image.version"",""required"":true},{""name"":""value"",""type"":""String"",""displayName"":""Label value"",""description"":""The value of the label."",""example"":""1.0.0"",""required"":true},{""name"":""overwriteExisting"",""type"":""Boolean"",""displayName"":""Overwrite existing"",""description"":""If true, overwrite the label if it already exists. If false, skip if exists. Defaults to true.""},{""name"":""stageName"",""type"":""String"",""displayName"":""Stage name"",""description"":""Only add the label to this build stage. If null, adds to the final stage only."",""example"":""final""}]",
maven,org.openrewrite:rewrite-docker,org.openrewrite.docker.ChangeBaseImage,Change Docker base image,Change the base image in a Dockerfile FROM instruction.,1,,Docker,,Recipes to perform [Docker](https://docker.com/) migration tasks.,"[{""name"":""oldImageName"",""type"":""String"",""displayName"":""Old image name"",""description"":""The old image name to replace. Supports glob patterns."",""example"":""ubuntu:20.04"",""required"":true},{""name"":""newImageName"",""type"":""String"",""displayName"":""New image name"",""description"":""The new image name to use."",""example"":""ubuntu:22.04"",""required"":true},{""name"":""oldPlatform"",""type"":""String"",""displayName"":""Old platform"",""description"":""Only change images with this platform. If null, matches any platform."",""example"":""linux/amd64""},{""name"":""newPlatform"",""type"":""String"",""displayName"":""New platform"",""description"":""Set the platform to this value. If null and oldPlatform is specified, removes the platform flag from matched images. If both oldPlatform and newPlatform are null, platform flags are preserved."",""example"":""linux/arm64""}]",
maven,org.openrewrite:rewrite-docker,org.openrewrite.docker.search.FindDockerBaseImages,Find Docker base images,Find all base images (FROM instructions) in Dockerfiles.,1,Search,Docker,,Recipes to perform [Docker](https://docker.com/) migration tasks.,"[{""name"":""imageNamePattern"",""type"":""String"",""displayName"":""Image name pattern"",""description"":""A glob pattern to match against base image names. If not specified, all base images are matched."",""example"":""ubuntu*""}]","[{""name"":""org.openrewrite.docker.table.DockerBaseImages"",""displayName"":""Docker base images"",""description"":""Records the base images found in Dockerfiles."",""columns"":[{""name"":""sourceFile"",""type"":""String"",""displayName"":""Source file"",""description"":""The Dockerfile containing the base image.""},{""name"":""stageName"",""type"":""String"",""displayName"":""Stage name"",""description"":""The build stage name (from AS clause), if specified.""},{""name"":""imageName"",""type"":""String"",""displayName"":""Image name"",""description"":""The name of the base image (without tag or digest).""},{""name"":""tag"",""type"":""String"",""displayName"":""Tag"",""description"":""The image tag, if specified.""},{""name"":""digest"",""type"":""String"",""displayName"":""Digest"",""description"":""The image digest, if specified.""},{""name"":""platform"",""type"":""String"",""displayName"":""Platform"",""description"":""The platform flag value, if specified.""}]}]"
maven,org.openrewrite:rewrite-docker,org.openrewrite.docker.search.FindExposedPorts,Find exposed ports,Find all EXPOSE instructions in Dockerfiles and report the exposed ports.,1,Search,Docker,,Recipes to perform [Docker](https://docker.com/) migration tasks.,"[{""name"":""portPattern"",""type"":""String"",""displayName"":""Port pattern"",""description"":""A glob pattern to filter ports. For example, '80*' to find ports starting with 80. If not specified, all EXPOSE instructions are matched."",""example"":""80*""}]","[{""name"":""org.openrewrite.docker.table.DockerExposedPorts"",""displayName"":""Docker exposed ports"",""description"":""Records all ports exposed in EXPOSE instructions in Dockerfiles."",""columns"":[{""name"":""sourceFile"",""type"":""String"",""displayName"":""Source file"",""description"":""The Dockerfile containing the EXPOSE instruction.""},{""name"":""stageName"",""type"":""String"",""displayName"":""Stage name"",""description"":""The build stage name if the EXPOSE is in a named stage.""},{""name"":""port"",""type"":""String"",""displayName"":""Port"",""description"":""The port number or range (e.g., '80' or '8000-8100').""},{""name"":""protocol"",""type"":""String"",""displayName"":""Protocol"",""description"":""The protocol if specified (tcp or udp), null if not specified.""}]}]"
maven,org.openrewrite:rewrite-docker,org.openrewrite.docker.search.FindMissingHealthcheck,Find missing HEALTHCHECK,Finds Dockerfiles where the final stage is missing a HEALTHCHECK instruction. Health checks help container orchestrators determine if a container is healthy and ready to receive traffic.,1,Search,Docker,,Recipes to perform [Docker](https://docker.com/) migration tasks.,,
maven,org.openrewrite:rewrite-docker,org.openrewrite.docker.search.FindRootUser,Find containers running as root,"Finds containers that run as root user. This includes explicit `USER root` or `USER 0` instructions, and optionally containers with no USER instruction in the final stage (which default to root).",1,Search,Docker,,Recipes to perform [Docker](https://docker.com/) migration tasks.,"[{""name"":""includeMissingUser"",""type"":""Boolean"",""displayName"":""Include missing USER"",""description"":""When true, also marks the final stage if no USER instruction is present (defaults to root). When false, only marks explicit USER root/0 instructions.""}]",
maven,org.openrewrite:rewrite-docker,org.openrewrite.docker.search.FindUnpinnedBaseImages,Find unpinned base images,"Finds FROM instructions that use unpinned base images. Images without an explicit tag default to 'latest', which is not reproducible. Images pinned by digest are considered acceptable.",1,Search,Docker,,Recipes to perform [Docker](https://docker.com/) migration tasks.,,
