name,displayName,description,category1,category2,category3,category4,option1Name,option1DisplayName,option1Description,option2Name,option2DisplayName,option2Description,option3Name,option3DisplayName,option3Description,option4Name,option4DisplayName,option4Description,option5Name,option5DisplayName,option5Description,option6Name,option6DisplayName,option6Description,ecosystem,packageName,version
org.openrewrite.java.search.ResultOfMethodCallIgnored,Result of method call ignored,Find locations where the result of the method call is being ignored.,Search,Java,Openrewrite,Org,methodPattern,Method pattern,"A [method pattern](https://docs.openrewrite.org/reference/method-patterns) is used to find matching method invocations. For example, to find all method invocations in the Guava library, use the pattern: `com.google.common..*#*(..)`.<br/><br/>The pattern format is `<PACKAGE>#<METHOD_NAME>(<ARGS>)`. <br/><br/>`..*` includes all subpackages of `com.google.common`. <br/>`*(..)` matches any method name with any number of arguments. <br/><br/>For more specific queries, like Guava's `ImmutableMap`, use `com.google.common.collect.ImmutableMap#*(..)` to narrow down the results.",matchOverrides,Match on overrides,"When enabled, find methods that are overrides of the method pattern.",,,,,,,,,,,,,maven,org.openrewrite:rewrite-core,8.64.0-SNAPSHOT
org.openrewrite.java.search.ClasspathTypeCounts,Study the size of the classpath by source set,"Emit one data table row per source set in a project, with the number of types in the source set.",Search,Java,Openrewrite,Org,,,,,,,,,,,,,,,,,,,maven,org.openrewrite:rewrite-core,8.64.0-SNAPSHOT
org.openrewrite.java.search.FindDistinctMethods,Find distinct methods in use,"A sample of every distinct method in use in a repository. The code sample in the method calls data table will be a representative use of the method, though there may be many other such uses of the method.",Search,Java,Openrewrite,Org,methodPattern,Method pattern,"A [method pattern](https://docs.openrewrite.org/reference/method-patterns) is used to find matching method invocations. For example, to find all method invocations in the Guava library, use the pattern: `com.google.common..*#*(..)`.<br/><br/>The pattern format is `<PACKAGE>#<METHOD_NAME>(<ARGS>)`. <br/><br/>`..*` includes all subpackages of `com.google.common`. <br/>`*(..)` matches any method name with any number of arguments. <br/><br/>For more specific queries, like Guava's `ImmutableMap`, use `com.google.common.collect.ImmutableMap#*(..)` to narrow down the results.",matchOverrides,Match on overrides,"When enabled, find methods that are overrides of the method pattern.",,,,,,,,,,,,,maven,org.openrewrite:rewrite-core,8.64.0-SNAPSHOT
org.openrewrite.java.search.FindTypeMappings,Find type mappings,Study the frequency of `J` types and their `JavaType` type attribution.,Search,Java,Openrewrite,Org,,,,,,,,,,,,,,,,,,,maven,org.openrewrite:rewrite-core,8.64.0-SNAPSHOT
org.openrewrite.java.search.HasMinimumJavaVersion,Find the oldest Java version in use,"The oldest Java version in use is the lowest Java version in use in any source set of any subproject of a repository. It is possible that, for example, the main source set of a project uses Java 8, but a test source set uses Java 17. In this case, the oldest Java version in use is Java 8.",Search,Java,Openrewrite,Org,version,Java version,An exact version number or node-style semver selector used to select the version number.,checkTargetCompatibility,Version check against target compatibility,The source and target compatibility versions can be different. This option allows you to check against the target compatibility version instead of the source compatibility version.,,,,,,,,,,,,,maven,org.openrewrite:rewrite-core,8.64.0-SNAPSHOT
org.openrewrite.java.search.FindSecrets,Find plain text secrets,Find secrets stored in plain text in code.,Search,Java,Openrewrite,Org,,,,,,,,,,,,,,,,,,,yaml,maven-rewrite-yaml:org.openrewrite:rewrite-core:8.64.0-SNAPSHOT!/META-INF/rewrite/find-plaintext-secrets.yml,8.64.0-SNAPSHOT
