name,displayName,description,category1,category2,category3,category4,option1Name,option1DisplayName,option1Description,option2Name,option2DisplayName,option2Description,option3Name,option3DisplayName,option3Description,option4Name,option4DisplayName,option4Description,option5Name,option5DisplayName,option5Description,option6Name,option6DisplayName,option6Description,ecosystem,packageName,version
org.openrewrite.java.AddCommentToImport,Add comment to import statement,Add a comment to an import statement in a Java source file.,Java,Openrewrite,Org,,comment,Comment,The comment to add.,typePattern,Type pattern,A type pattern that is used to find matching imports uses.,,,,,,,,,,,,,maven,org.openrewrite:rewrite-core,8.64.0-SNAPSHOT
org.openrewrite.java.AddCommentToMethod,Add comment to method declarations,Add a comment to method declarations in a Java source file.,Java,Openrewrite,Org,,comment,Comment,The comment to add.,methodPattern,Method pattern,"A pattern to match methods to add the comment to. A [method pattern](https://docs.openrewrite.org/reference/method-patterns) is used to find matching method declarations. For example, to find all method declarations in the Guava library, use the pattern: `com.google.common..*#*(..)`.<br/><br/>The pattern format is `<PACKAGE>#<METHOD_NAME>(<ARGS>)`. <br/><br/>`..*` includes all subpackages of `com.google.common`. <br/>`*(..)` matches any method name with any number of arguments. <br/><br/>For more specific queries, like Guava's `ImmutableMap`, use `com.google.common.collect.ImmutableMap#*(..)` to narrow down the results.",isMultiline,Multiline,Comments use by default single line // but they can use multiline /* */.,,,,,,,,,,maven,org.openrewrite:rewrite-core,8.64.0-SNAPSHOT
org.openrewrite.java.AddCommentToMethodInvocations,Add comment to method invocations,Add a comment to method invocations in a Java source file.,Java,Openrewrite,Org,,comment,Comment,The comment to add.,methodPattern,Method pattern,"A pattern to match methods to add the comment to. A [method pattern](https://docs.openrewrite.org/reference/method-patterns) is used to find matching method invocations. For example, to find all method invocations in the Guava library, use the pattern: `com.google.common..*#*(..)`.<br/><br/>The pattern format is `<PACKAGE>#<METHOD_NAME>(<ARGS>)`. <br/><br/>`..*` includes all subpackages of `com.google.common`. <br/>`*(..)` matches any method name with any number of arguments. <br/><br/>For more specific queries, like Guava's `ImmutableMap`, use `com.google.common.collect.ImmutableMap#*(..)` to narrow down the results.",,,,,,,,,,,,,maven,org.openrewrite:rewrite-core,8.64.0-SNAPSHOT
org.openrewrite.java.AddLicenseHeader,Add license header,Adds license headers to Java source files when missing. Does not override existing license headers.,Java,Openrewrite,Org,,licenseText,License text,The license header text without the block comment. May contain ${CURRENT_YEAR} property.,,,,,,,,,,,,,,,,maven,org.openrewrite:rewrite-core,8.64.0-SNAPSHOT
org.openrewrite.java.AddLiteralMethodArgument,Add a literal method argument,Add a literal `String` or `int` argument to method invocations.,Java,Openrewrite,Org,,methodPattern,Method pattern,"A [method pattern](https://docs.openrewrite.org/reference/method-patterns) is used to find matching method invocations. For example, to find all method invocations in the Guava library, use the pattern: `com.google.common..*#*(..)`.<br/><br/>The pattern format is `<PACKAGE>#<METHOD_NAME>(<ARGS>)`. <br/><br/>`..*` includes all subpackages of `com.google.common`. <br/>`*(..)` matches any method name with any number of arguments. <br/><br/>For more specific queries, like Guava's `ImmutableMap`, use `com.google.common.collect.ImmutableMap#*(..)` to narrow down the results.",argumentIndex,Argument index,A zero-based index that indicates which argument will be added as null to the method invocation.,literal,Literal,The literal value that we add the argument for.,primitiveType,Parameter type,The type of the parameter that we add the argument for. Defaults to `String`.,,,,,,,maven,org.openrewrite:rewrite-core,8.64.0-SNAPSHOT
org.openrewrite.java.AddMethodParameter,Add method parameter to a method declaration,Adds a new method parameter to an existing method declaration.,Java,Openrewrite,Org,,methodPattern,Method pattern,A method pattern that is used to find the method declarations to modify.,parameterType,Parameter type,The type of the parameter that gets added.,parameterName,Parameter name,The name of the parameter that gets added.,parameterIndex,Parameter index,A zero-based index that indicates the position at which the parameter will be added. At the end by default.,,,,,,,maven,org.openrewrite:rewrite-core,8.64.0-SNAPSHOT
org.openrewrite.java.AddNullMethodArgument,Add a `null` method argument,Add a `null` argument to method invocations.,Java,Openrewrite,Org,,methodPattern,Method pattern,"A [method pattern](https://docs.openrewrite.org/reference/method-patterns) is used to find matching method invocations. For example, to find all method invocations in the Guava library, use the pattern: `com.google.common..*#*(..)`.<br/><br/>The pattern format is `<PACKAGE>#<METHOD_NAME>(<ARGS>)`. <br/><br/>`..*` includes all subpackages of `com.google.common`. <br/>`*(..)` matches any method name with any number of arguments. <br/><br/>For more specific queries, like Guava's `ImmutableMap`, use `com.google.common.collect.ImmutableMap#*(..)` to narrow down the results.",argumentIndex,Argument index,A zero-based index that indicates which argument will be added as null to the method invocation.,parameterType,Parameter type,The type of the parameter that we add the argument for.,parameterName,Parameter name,The name of the parameter that we add the argument for.,explicitCast,Explicit cast,Explicitly cast the argument to the parameter type. Useful if the method is overridden with another type.,,,,maven,org.openrewrite:rewrite-core,8.64.0-SNAPSHOT
org.openrewrite.java.AddOrUpdateAnnotationAttribute,Add or update annotation attribute,"Some annotations accept arguments. This recipe sets an existing argument to the specified value, or adds the argument if it is not already set.",Java,Openrewrite,Org,,annotationType,Annotation type,The fully qualified name of the annotation.,attributeName,Attribute name,The name of attribute to change. If omitted defaults to 'value'.,attributeValue,Attribute value,"The value to set the attribute to. If the attribute is an array, provide values separated by comma to add multiple attributes at once. Set to `null` to remove the attribute.",oldAttributeValue,Old Attribute value,"The current value of the attribute, this can be used to filter where the change is applied. Set to `null` for wildcard behavior.",addOnly,Add only,"If `true`, disables upgrading existing annotation attribute values, thus the recipe will only add the attribute if it does not already exist. If omitted or `false`, the recipe adds the attribute if missing or updates its value if present.",appendArray,Append array,"If the attribute is an array and attribute is present, setting this option to `true` will append the value(s). Duplicate values will not be added. If omitted or `false`, the recipe will replace the existing value(s) with the new value(s).",maven,org.openrewrite:rewrite-core,8.64.0-SNAPSHOT
org.openrewrite.java.ChangeAnnotationAttributeName,Change annotation attribute name,Some annotations accept arguments. This recipe renames an existing attribute.,Java,Openrewrite,Org,,annotationType,Annotation Type,The fully qualified name of the annotation.,oldAttributeName,Old attribute name,The name of attribute to change.,newAttributeName,New attribute name,The new attribute name to use.,,,,,,,,,,maven,org.openrewrite:rewrite-core,8.64.0-SNAPSHOT
org.openrewrite.java.ChangeMethodAccessLevel,Change method access level,"Change the access level (public, protected, private, package private) of a method.",Java,Openrewrite,Org,,methodPattern,Method pattern,"A [method pattern](https://docs.openrewrite.org/reference/method-patterns) is used to find matching method invocations. For example, to find all method invocations in the Guava library, use the pattern: `com.google.common..*#*(..)`.<br/><br/>The pattern format is `<PACKAGE>#<METHOD_NAME>(<ARGS>)`. <br/><br/>`..*` includes all subpackages of `com.google.common`. <br/>`*(..)` matches any method name with any number of arguments. <br/><br/>For more specific queries, like Guava's `ImmutableMap`, use `com.google.common.collect.ImmutableMap#*(..)` to narrow down the results.",newAccessLevel,New access level,New method access level to apply to the method.,matchOverrides,Match on overrides,"When enabled, find methods that are overrides of the method pattern.",,,,,,,,,,maven,org.openrewrite:rewrite-core,8.64.0-SNAPSHOT
org.openrewrite.java.ChangeMethodInvocationReturnType,Change method invocation return type,Changes the return type of a method invocation.,Java,Openrewrite,Org,,methodPattern,Method pattern,"A [method pattern](https://docs.openrewrite.org/reference/method-patterns) is used to find matching method invocations. For example, to find all method invocations in the Guava library, use the pattern: `com.google.common..*#*(..)`.<br/><br/>The pattern format is `<PACKAGE>#<METHOD_NAME>(<ARGS>)`. <br/><br/>`..*` includes all subpackages of `com.google.common`. <br/>`*(..)` matches any method name with any number of arguments. <br/><br/>For more specific queries, like Guava's `ImmutableMap`, use `com.google.common.collect.ImmutableMap#*(..)` to narrow down the results.",newReturnType,New method invocation return type,The fully qualified new return type of method invocation.,,,,,,,,,,,,,maven,org.openrewrite:rewrite-core,8.64.0-SNAPSHOT
org.openrewrite.java.ChangeMethodName,Change method name,Rename a method.,Java,Openrewrite,Org,,methodPattern,Method pattern,"A [method pattern](https://docs.openrewrite.org/reference/method-patterns) is used to find matching method invocations. For example, to find all method invocations in the Guava library, use the pattern: `com.google.common..*#*(..)`.<br/><br/>The pattern format is `<PACKAGE>#<METHOD_NAME>(<ARGS>)`. <br/><br/>`..*` includes all subpackages of `com.google.common`. <br/>`*(..)` matches any method name with any number of arguments. <br/><br/>For more specific queries, like Guava's `ImmutableMap`, use `com.google.common.collect.ImmutableMap#*(..)` to narrow down the results.",newMethodName,New method name,The method name that will replace the existing name.,matchOverrides,Match on overrides,"When enabled, find methods that are overrides of the method pattern.",ignoreDefinition,Ignore type definition,When set to `true` the definition of the old type will be left untouched. This is useful when you're replacing usage of a class but don't want to rename it.,,,,,,,maven,org.openrewrite:rewrite-core,8.64.0-SNAPSHOT
org.openrewrite.java.ChangeMethodTargetToStatic,Change method target to static,Change method invocations to static method calls.,Java,Openrewrite,Org,,methodPattern,Method pattern,"The original method call may or may not be a static method invocation. A [method pattern](https://docs.openrewrite.org/reference/method-patterns) is used to find matching method invocations. For example, to find all method invocations in the Guava library, use the pattern: `com.google.common..*#*(..)`.<br/><br/>The pattern format is `<PACKAGE>#<METHOD_NAME>(<ARGS>)`. <br/><br/>`..*` includes all subpackages of `com.google.common`. <br/>`*(..)` matches any method name with any number of arguments. <br/><br/>For more specific queries, like Guava's `ImmutableMap`, use `com.google.common.collect.ImmutableMap#*(..)` to narrow down the results.",fullyQualifiedTargetTypeName,Fully-qualified target type name,A fully-qualified class name of the type upon which the static method is defined.,returnType,Return type after change,"Sometimes changing the target type also changes the return type. In the Guava example, changing from `ImmutableSet#of(..)` to `Set#of(..)` widens the return type from Guava's `ImmutableSet` to just `java.util.Set`.",matchOverrides,Match on overrides,"When enabled, find methods that are overrides of the method pattern.",matchUnknownTypes,Match unknown types,"When enabled, include method invocations which appear to match if full type information is missing. Using matchUnknownTypes can improve recipe resiliency for an AST with missing type information, but also increases the risk of false-positive matches on unrelated method invocations.",,,,maven,org.openrewrite:rewrite-core,8.64.0-SNAPSHOT
org.openrewrite.java.ChangeMethodTargetToVariable,Change method target to variable,Change method invocations to method calls on a variable.,Java,Openrewrite,Org,,methodPattern,Method pattern,"A [method pattern](https://docs.openrewrite.org/reference/method-patterns) is used to find matching method invocations. For example, to find all method invocations in the Guava library, use the pattern: `com.google.common..*#*(..)`.<br/><br/>The pattern format is `<PACKAGE>#<METHOD_NAME>(<ARGS>)`. <br/><br/>`..*` includes all subpackages of `com.google.common`. <br/>`*(..)` matches any method name with any number of arguments. <br/><br/>For more specific queries, like Guava's `ImmutableMap`, use `com.google.common.collect.ImmutableMap#*(..)` to narrow down the results.",variableName,Variable name,Name of variable to use as target for the modified method invocation.,variableType,Variable type,Type attribution to use for the return type of the modified method invocation.,matchOverrides,Match on overrides,"When enabled, find methods that are overrides of the method pattern.",,,,,,,maven,org.openrewrite:rewrite-core,8.64.0-SNAPSHOT
org.openrewrite.java.ChangePackage,Rename package name,"A recipe that will rename a package name in package statements, imports, and fully-qualified types.",Java,Openrewrite,Org,,oldPackageName,Old package name,The package name to replace.,newPackageName,New package name,New package name to replace the old package name with.,recursive,Recursive,Recursively change subpackage names,,,,,,,,,,maven,org.openrewrite:rewrite-core,8.64.0-SNAPSHOT
org.openrewrite.java.ChangePackageInStringLiteral,Rename package name in String literals,A recipe that will rename a package name in String literals.,Java,Openrewrite,Org,,oldPackageName,Old package name,The package name to replace.,newPackageName,New package name,New package name to replace the old package name with.,,,,,,,,,,,,,maven,org.openrewrite:rewrite-core,8.64.0-SNAPSHOT
org.openrewrite.java.ChangeStaticFieldToMethod,Change static field access to static method access,Migrate accesses to a static field to invocations of a static method.,Java,Openrewrite,Org,,oldClassName,Old class name,The fully qualified name of the class containing the field to replace.,oldFieldName,Old field name,The simple name of the static field to replace.,newClassName,New class name,The fully qualified name of the class containing the method to use. Leave empty to keep the same class.,newTarget,New field target,An optional method target that can be used to specify a static field within the new class.,newMethodName,New method name,The simple name of the method to use. The method must be static and have no arguments.,,,,maven,org.openrewrite:rewrite-core,8.64.0-SNAPSHOT
org.openrewrite.java.ChangeType,Change type,Change a given type to another.,Java,Openrewrite,Org,,oldFullyQualifiedTypeName,Old fully-qualified type name,Fully-qualified class name of the original type.,newFullyQualifiedTypeName,New fully-qualified type name,"Fully-qualified class name of the replacement type, or the name of a primitive such as ""int"". The `OuterClassName$NestedClassName` naming convention should be used for nested classes.",ignoreDefinition,Ignore type definition,When set to `true` the definition of the old type will be left untouched. This is useful when you're replacing usage of a class but don't want to rename it.,,,,,,,,,,maven,org.openrewrite:rewrite-core,8.64.0-SNAPSHOT
org.openrewrite.java.ChangeTypeInStringLiteral,Change type in String literals,Change a given type to another when used in a String literal.,Java,Openrewrite,Org,,oldFullyQualifiedTypeName,Old fully-qualified type name,Fully-qualified class name of the original type.,newFullyQualifiedTypeName,New fully-qualified type name,"Fully-qualified class name of the replacement type, or the name of a primitive such as ""int"". The `OuterClassName$NestedClassName` naming convention should be used for nested classes.",,,,,,,,,,,,,maven,org.openrewrite:rewrite-core,8.64.0-SNAPSHOT
org.openrewrite.java.DeleteMethodArgument,Delete method argument,Delete an argument from method invocations.,Java,Openrewrite,Org,,methodPattern,Method pattern,"A [method pattern](https://docs.openrewrite.org/reference/method-patterns) is used to find matching method invocations. For example, to find all method invocations in the Guava library, use the pattern: `com.google.common..*#*(..)`.<br/><br/>The pattern format is `<PACKAGE>#<METHOD_NAME>(<ARGS>)`. <br/><br/>`..*` includes all subpackages of `com.google.common`. <br/>`*(..)` matches any method name with any number of arguments. <br/><br/>For more specific queries, like Guava's `ImmutableMap`, use `com.google.common.collect.ImmutableMap#*(..)` to narrow down the results.",argumentIndex,Argument index,A zero-based index that indicates which argument will be removed from the method invocation.,,,,,,,,,,,,,maven,org.openrewrite:rewrite-core,8.64.0-SNAPSHOT
org.openrewrite.java.InlineMethodCalls,Inline method calls,"Inline method calls using a template replacement pattern. Supports both method invocations and constructor calls, with optional imports.",Java,Openrewrite,Org,,methodPattern,Method pattern,A method pattern that is used to find matching method invocations.,replacement,Replacement template,The replacement template for the method invocation. Parameters can be referenced using their names from the original method.,imports,Imports,List of regular imports to add when the replacement is made.,staticImports,Static imports,List of static imports to add when the replacement is made.,classpathFromResources,Classpath from resources,List of paths to JAR files on the classpath for parsing the replacement template.,,,,maven,org.openrewrite:rewrite-core,8.64.0-SNAPSHOT
org.openrewrite.java.NoStaticImport,Remove static import,"Removes static imports and replaces them with qualified references. For example, `emptyList()` becomes `Collections.emptyList()`.",Java,Openrewrite,Org,,methodPattern,Method pattern,"A [method pattern](https://docs.openrewrite.org/reference/method-patterns) is used to find matching method invocations. For example, to find all method invocations in the Guava library, use the pattern: `com.google.common..*#*(..)`.<br/><br/>The pattern format is `<PACKAGE>#<METHOD_NAME>(<ARGS>)`. <br/><br/>`..*` includes all subpackages of `com.google.common`. <br/>`*(..)` matches any method name with any number of arguments. <br/><br/>For more specific queries, like Guava's `ImmutableMap`, use `com.google.common.collect.ImmutableMap#*(..)` to narrow down the results.",,,,,,,,,,,,,,,,maven,org.openrewrite:rewrite-core,8.64.0-SNAPSHOT
org.openrewrite.java.OrderImports,Order imports,"Groups and orders import statements. If a [style has been defined](https://docs.openrewrite.org/concepts-and-explanations/styles), this recipe will order the imports according to that style. If no style is detected, this recipe will default to ordering imports in the same way that IntelliJ IDEA does.",Java,Openrewrite,Org,,removeUnused,Remove unused,Remove unnecessary imports.,,,,,,,,,,,,,,,,maven,org.openrewrite:rewrite-core,8.64.0-SNAPSHOT
org.openrewrite.java.RandomizeId,Randomize tree IDs,Scramble the IDs. This was intended as a utility to test _en masse_ different techniques for UUID generation and compare their relative performance outside a microbenchmark.,Java,Openrewrite,Org,,,,,,,,,,,,,,,,,,,,maven,org.openrewrite:rewrite-core,8.64.0-SNAPSHOT
org.openrewrite.java.RecipeMarkupDemonstration,Demonstrate rendering of `Markup` markers,Tooling may decide to elide or display differently markup of different levels.,Java,Openrewrite,Org,,level,Level,The `Markup#Level` to add.,,,,,,,,,,,,,,,,maven,org.openrewrite:rewrite-core,8.64.0-SNAPSHOT
org.openrewrite.java.RemoveAnnotation,Remove annotation,Remove matching annotations wherever they occur.,Java,Openrewrite,Org,,annotationPattern,Annotation pattern,"An annotation pattern, expressed as a method pattern.",,,,,,,,,,,,,,,,maven,org.openrewrite:rewrite-core,8.64.0-SNAPSHOT
org.openrewrite.java.RemoveAnnotationAttribute,Remove annotation attribute,Some annotations accept arguments. This recipe removes an existing attribute.,Java,Openrewrite,Org,,annotationType,Annotation Type,The fully qualified name of the annotation.,attributeName,Attribute name,The name of attribute to remove.,,,,,,,,,,,,,maven,org.openrewrite:rewrite-core,8.64.0-SNAPSHOT
org.openrewrite.java.RemoveImplements,Remove interface implementations,Removes `implements` clauses from classes implementing the specified interface. Removes `@Overrides` annotations from methods which no longer override anything.,Java,Openrewrite,Org,,interfaceType,Interface type,The fully qualified name of the interface to remove.,filter,Filter,Only apply the interface removal to classes with fully qualified names that begin with this filter. `null` or empty matches all classes.,,,,,,,,,,,,,maven,org.openrewrite:rewrite-core,8.64.0-SNAPSHOT
org.openrewrite.java.RemoveMethodInvocations,Remove method invocations,Remove method invocations if syntactically safe.,Java,Openrewrite,Org,,methodPattern,Method pattern,"A pattern to match method invocations for removal. A [method pattern](https://docs.openrewrite.org/reference/method-patterns) is used to find matching method invocations. For example, to find all method invocations in the Guava library, use the pattern: `com.google.common..*#*(..)`.<br/><br/>The pattern format is `<PACKAGE>#<METHOD_NAME>(<ARGS>)`. <br/><br/>`..*` includes all subpackages of `com.google.common`. <br/>`*(..)` matches any method name with any number of arguments. <br/><br/>For more specific queries, like Guava's `ImmutableMap`, use `com.google.common.collect.ImmutableMap#*(..)` to narrow down the results.",,,,,,,,,,,,,,,,maven,org.openrewrite:rewrite-core,8.64.0-SNAPSHOT
org.openrewrite.java.RemoveObjectsIsNull,Transform calls to `Objects.isNull(..)` and `Objects.nonNull(..)`,Replace calls to `Objects.isNull(..)` and `Objects.nonNull(..)` with a simple null check. Using these methods outside of stream predicates is not idiomatic.,Java,Openrewrite,Org,,,,,,,,,,,,,,,,,,,,maven,org.openrewrite:rewrite-core,8.64.0-SNAPSHOT
org.openrewrite.java.RemoveUnusedImports,Remove unused imports,"Remove imports for types that are not referenced. As a precaution against incorrect changes no imports will be removed from any source where unknown types are referenced. The most common cause of unknown types is the use of annotation processors not supported by OpenRewrite, such as lombok.",Java,Openrewrite,Org,,,,,,,,,,,,,,,,,,,,maven,org.openrewrite:rewrite-core,8.64.0-SNAPSHOT
org.openrewrite.java.ReorderMethodArguments,Reorder method arguments,Reorder method arguments into the specified order.,Java,Openrewrite,Org,,methodPattern,Method pattern,"A [method pattern](https://docs.openrewrite.org/reference/method-patterns) is used to find matching method invocations. For example, to find all method invocations in the Guava library, use the pattern: `com.google.common..*#*(..)`.<br/><br/>The pattern format is `<PACKAGE>#<METHOD_NAME>(<ARGS>)`. <br/><br/>`..*` includes all subpackages of `com.google.common`. <br/>`*(..)` matches any method name with any number of arguments. <br/><br/>For more specific queries, like Guava's `ImmutableMap`, use `com.google.common.collect.ImmutableMap#*(..)` to narrow down the results.",newParameterNames,New parameter names,An array of parameter names that indicates the new order in which those arguments should be arranged.,oldParameterNames,Old parameter names,"If the original method signature is not type-attributed, this is an optional list that indicates the original order in which the arguments were arranged.",ignoreDefinition,Ignore type definition,When set to `true` the definition of the old type will be left untouched. This is useful when you're replacing usage of a class but don't want to rename it.,matchOverrides,Match on overrides,"When enabled, find methods that are overrides of the method pattern.",,,,maven,org.openrewrite:rewrite-core,8.64.0-SNAPSHOT
org.openrewrite.java.ReplaceAnnotation,Replace annotation,Replace an Annotation with another one if the annotation pattern matches. Only fixed parameters can be set in the replacement.,Java,Openrewrite,Org,,annotationPatternToReplace,Annotation to replace,"An annotation matcher, expressed as a method pattern to replace.",annotationTemplateToInsert,Annotation template to insert,"An annotation template to add instead of original one, will be parsed with `JavaTemplate`.",classpathResourceName,Classpath resource,If the annotation's type is defined by a jar within the META-INF/rewrite/classpath directory provide its name here so that it can be loaded. When this parameter is not passed the runtime classpath of the recipe is provided to the parser producing the new annotation. This is necessary when the annotation is not on the runtime classpath of the recipe and isn't in the Java standard library.,,,,,,,,,,maven,org.openrewrite:rewrite-core,8.64.0-SNAPSHOT
